{"artifactType":"repopass-acceptance-registry","product":"repopass","rows":[{"appliesTo":["github","repository"],"criterion":"The baseline revision equals the live default branch, or default-branch drift is recorded and the baseline is recomputed.","evaluation":{"kind":"required-checks","requiredChecks":["ci/container-matrix","ci/go","ci/schema-json","ci/windows-go"]},"id":"RP-B00","milestone":"BASELINE","required":true},{"appliesTo":["linux-amd64","repository","windows-amd64"],"criterion":"Source gates pass on their first attempt; public output and receipts remain outside the repository and contain no secret.","evaluation":{"kind":"not-run","reasonCode":"ROADMAP_WORK_NOT_SCHEDULED"},"id":"RP-B01","milestone":"BASELINE","required":true},{"appliesTo":["docker-linux-amd64","podman-linux-amd64"],"criterion":"Current-source container evidence and historical Alpha evidence are classified without presenting historical evidence as current.","evaluation":{"kind":"not-run","reasonCode":"ROADMAP_WORK_NOT_SCHEDULED"},"id":"RP-B02","milestone":"BASELINE","required":true},{"appliesTo":["docker-linux-amd64","podman-linux-amd64","repository"],"criterion":"The source worktree is clean before and after the baseline, with no process, container, network, or volume residue.","evaluation":{"kind":"not-run","reasonCode":"ROADMAP_WORK_NOT_SCHEDULED"},"id":"RP-B03","milestone":"BASELINE","required":true},{"appliesTo":["docker-linux-amd64","podman-linux-amd64"],"criterion":"Healthy results remain capability INCOMPLETE and overall INCONCLUSIVE until the required observations exist.","evaluation":{"kind":"required-checks","requiredChecks":["ci/container-matrix"]},"id":"RP-B04","milestone":"BASELINE","required":true},{"appliesTo":["linux-amd64","repository","windows-amd64"],"criterion":"The complete fixture matrix and frozen fuzz or property seeds pass on Linux and Windows build paths, and malicious fixtures fail closed.","evaluation":{"kind":"not-run","reasonCode":"ROADMAP_WORK_NOT_SCHEDULED"},"id":"RP-M0-CORPUS","milestone":"M0","required":true},{"appliesTo":["linux-amd64","release","repository","windows-amd64"],"criterion":"Clone, build, import, module metadata, and release assets use one exact canonical repository namespace.","evaluation":{"kind":"required-checks","requiredChecks":["ci/go","ci/windows-go"]},"id":"RP-M0-MODULE","milestone":"M0","required":true},{"appliesTo":["linux-amd64","repository","windows-amd64"],"criterion":"The current source archive, required tests, and receipts bind one exact source revision and tree without repackaging historical Alpha evidence.","evaluation":{"kind":"blocked","reasonCode":"SOURCE_QUALIFICATION_PREREQUISITES_UNAVAILABLE"},"id":"RP-M0-QUAL","milestone":"M0","required":true},{"appliesTo":["linux-amd64","repository","windows-amd64"],"criterion":"Every public schema, specification, and reference behavior has machine-readable conformance coverage and unknown semantics fail closed.","evaluation":{"kind":"not-run","reasonCode":"ROADMAP_WORK_NOT_SCHEDULED"},"id":"RP-M0-SPEC","milestone":"M0","required":true},{"appliesTo":["docker-linux-amd64","podman-linux-amd64"],"criterion":"CLI and HTTP healthy journeys pass functionally, remain reproducibly stable, and clean up on every supported Docker and Podman tuple.","evaluation":{"kind":"required-checks","requiredChecks":["ci/container-matrix"]},"id":"RP-M1-JOURNEY","milestone":"M1","required":true},{"appliesTo":["docker-linux-amd64","podman-linux-amd64"],"criterion":"Every required observer category reaches its normative high or complete coverage and gap or overflow fixtures remain incomplete.","evaluation":{"kind":"not-run","reasonCode":"ROADMAP_WORK_NOT_SCHEDULED"},"id":"RP-M2-COVERAGE","milestone":"M2","required":true},{"appliesTo":["docker-linux-amd64","podman-linux-amd64"],"criterion":"Docker and Podman each have current exact-source clean-VM evidence with no required skip or retry laundering.","evaluation":{"kind":"not-run","reasonCode":"ROADMAP_WORK_NOT_SCHEDULED"},"id":"RP-M2-MATRIX","milestone":"M2","required":true},{"appliesTo":["docker-linux-amd64","podman-linux-amd64"],"criterion":"Success, timeout, cancellation, crash, termination-resistant, and early-exit paths restore the after-inventory to the baseline.","evaluation":{"kind":"not-run","reasonCode":"ROADMAP_WORK_NOT_SCHEDULED"},"id":"RP-M2-RESIDUE","milestone":"M2","required":true},{"appliesTo":["docker-linux-amd64","podman-linux-amd64"],"criterion":"At least one healthy Node and Python profile honestly reaches capability CONFORMING and overall VERIFIED while adversarial gaps do not.","evaluation":{"kind":"not-run","reasonCode":"ROADMAP_WORK_NOT_SCHEDULED"},"id":"RP-M2-VERDICT","milestone":"M2","required":true},{"appliesTo":["external-review","release"],"criterion":"Accepted evidence is authorized by external identity and policy; self-signed, unknown, revoked, or stale signers are not accepted.","evaluation":{"kind":"not-run","reasonCode":"ROADMAP_WORK_NOT_SCHEDULED"},"id":"RP-M3-IDENTITY","milestone":"M3","required":true},{"appliesTo":["external-review","release"],"criterion":"Removal, rename, remint, signature, key, policy, source, and SBOM substitution all fail closed.","evaluation":{"kind":"not-run","reasonCode":"ROADMAP_WORK_NOT_SCHEDULED"},"id":"RP-M3-INTEGRITY","milestone":"M3","required":true},{"appliesTo":["linux-amd64","release","windows-amd64"],"criterion":"The release verifier kit validates the exact bundle on two clean operating systems without the producer worktree.","evaluation":{"kind":"not-run","reasonCode":"ROADMAP_WORK_NOT_SCHEDULED"},"id":"RP-M3-PORTABLE","milestone":"M3","required":true},{"appliesTo":["release","repository"],"criterion":"Every public file is typed and privacy-checked, and raw data renamed into an allowlisted slot is still rejected.","evaluation":{"kind":"not-run","reasonCode":"ROADMAP_WORK_NOT_SCHEDULED"},"id":"RP-M3-PRIVACY","milestone":"M3","required":true},{"appliesTo":["github"],"criterion":"A real pull-request check binds the exact pull-request revision and maps healthy, failed, and inconclusive results according to the specification.","evaluation":{"kind":"not-run","reasonCode":"ROADMAP_WORK_NOT_SCHEDULED"},"id":"RP-M4-CHECK","milestone":"M4","required":true},{"appliesTo":["github"],"criterion":"A fork pull request receives no secret or write authority and artifact substitution cannot deceive the privileged publisher.","evaluation":{"kind":"not-run","reasonCode":"ROADMAP_WORK_NOT_SCHEDULED"},"id":"RP-M4-FORK","milestone":"M4","required":true},{"appliesTo":["github","release"],"criterion":"A downloaded check artifact is independently verifiable and binds its workflow run and source revision.","evaluation":{"kind":"not-run","reasonCode":"ROADMAP_WORK_NOT_SCHEDULED"},"id":"RP-M4-REPRO","milestone":"M4","required":true},{"appliesTo":["ui"],"criterion":"A new user can follow the README on a clean machine, complete the local trial, and verify the evidence.","evaluation":{"kind":"not-run","reasonCode":"ROADMAP_WORK_NOT_SCHEDULED"},"id":"RP-M5-JOURNEY","milestone":"M5","required":true},{"appliesTo":["ui"],"criterion":"Untrusted repository text or reports cannot execute script, inject HTML, open arbitrary network access, or disclose raw evidence.","evaluation":{"kind":"not-run","reasonCode":"ROADMAP_WORK_NOT_SCHEDULED"},"id":"RP-M5-SECURITY","milestone":"M5","required":true},{"appliesTo":["ui"],"criterion":"Every UI status traces to the canonical model and visibly preserves INCOMPLETE or INCONCLUSIVE rather than presenting success.","evaluation":{"kind":"not-run","reasonCode":"ROADMAP_WORK_NOT_SCHEDULED"},"id":"RP-M5-TRUTH","milestone":"M5","required":true},{"appliesTo":["hosted-runner"],"criterion":"A compromised worker or forged result cannot produce accepted evidence or a passing GitHub Check.","evaluation":{"kind":"not-run","reasonCode":"ROADMAP_WORK_NOT_SCHEDULED"},"id":"RP-M6-AUTHORITY","milestone":"M6","required":true},{"appliesTo":["hosted-runner"],"criterion":"Every termination path destroys the VM and credential, seals its store prefix, and restores the after-inventory to baseline.","evaluation":{"kind":"not-run","reasonCode":"ROADMAP_WORK_NOT_SCHEDULED"},"id":"RP-M6-CLEANUP","milestone":"M6","required":true},{"appliesTo":["hosted-runner"],"criterion":"Two concurrent tenants have no filesystem, process, network, or artifact cross-contamination.","evaluation":{"kind":"not-run","reasonCode":"ROADMAP_WORK_NOT_SCHEDULED"},"id":"RP-M6-ISOLATION","milestone":"M6","required":true},{"appliesTo":["hosted-runner"],"criterion":"An owner-controlled hosted environment has current-source evidence; without real infrastructure this row remains blocked.","evaluation":{"kind":"not-run","reasonCode":"ROADMAP_WORK_NOT_SCHEDULED"},"id":"RP-M6-LIVE","milestone":"M6","required":true},{"appliesTo":["plugin"],"criterion":"Unauthorized I/O is blocked before it occurs and a plugin cannot change policy, coverage, or the overall verdict.","evaluation":{"kind":"not-run","reasonCode":"ROADMAP_WORK_NOT_SCHEDULED"},"id":"RP-M7-CAPABILITY","milestone":"M7","required":true},{"appliesTo":["plugin"],"criterion":"Two reference plugins pass the same conformance kit and unsupported protocol versions return a stable error.","evaluation":{"kind":"not-run","reasonCode":"ROADMAP_WORK_NOT_SCHEDULED"},"id":"RP-M7-CONFORMANCE","milestone":"M7","required":true},{"appliesTo":["plugin","release"],"criterion":"Plugin signature, trust, SBOM, and currentness are verifiable and an unknown signer remains unknown or blocked.","evaluation":{"kind":"not-run","reasonCode":"ROADMAP_WORK_NOT_SCHEDULED"},"id":"RP-M7-SUPPLYCHAIN","milestone":"M7","required":true},{"appliesTo":["external-review","release"],"criterion":"An independent reviewer approves and hash-freezes the acceptance policy before observing results.","evaluation":{"kind":"not-run","reasonCode":"ROADMAP_WORK_NOT_SCHEDULED"},"id":"RP-Q-PROTOCOL","milestone":"QUALIFICATION","required":true},{"appliesTo":["external-review","release"],"criterion":